title,competation,time,country
Team oNe Esports vs YeaH Gaming,Challenger League Season 9 Latin America,"Sunday, Mar 31 2019, 0:00 UTC",Latin America
Supremacy vs EnD Gaming,Challenger League Season 9 Europe,"Monday, Apr 8 2019, 19:00 UTC",Europe
SemOrg Team vs Guidance Gaming,Challenger League Season 9 Latin America,"Sunday, Mar 31 2019, 0:00 UTC",Latin America
Pain Gaming vs Red Devils e-Sports,Brasileirão 2019,"Sunday, Mar 31 2019, 21:00 UTC","LAN,"
WP Gaming vs SG e-sports,Challenger League Season 9 Latin America,"Sunday, Mar 31 2019, 0:00 UTC",Latin America
Team GoSkilla vs XTreme Video,Challenger League Season 9 Europe,"Monday, Apr 1 2019, 18:00 UTC",Europe
PACT vs Team Vitality,Challenger League Season 9 Europe,"Monday, Apr 1 2019, 18:00 UTC",Europe
Supremacy vs MnM Gaming,Challenger League Season 9 Europe,"Monday, Apr 1 2019, 19:00 UTC",Europe
XTreme Video vs PACT,Challenger League Season 9 Europe,"Monday, Apr 1 2019, 20:00 UTC",Europe
Team Liquid vs Black Dragons,Brasileirão 2019,"Sunday, Mar 31 2019, 23:00 UTC","LAN,"
EnD Gaming vs Trust Gaming,Challenger League Season 9 Europe,"Monday, Apr 1 2019, 19:00 UTC",Europe
MnM Gaming vs EnD Gaming,Challenger League Season 9 Europe,"Monday, Apr 1 2019, 21:00 UTC",Europe
Team GoSkilla vs Team Vitality,Challenger League Season 9 Europe,"Monday, Apr 1 2019, 21:00 UTC",Europe
Rogue vs Team Reciprocity,Pro League Season 9 North America,"Tuesday, Apr 2 2019, 0:00 UTC",North America
DarkZero Esports vs Excelerate Gaming,Pro League Season 9 North America,"Tuesday, Apr 2 2019, 1:00 UTC",North America
Evil Geniuses vs Rise Nation,Pro League Season 9 North America,"Tuesday, Apr 2 2019, 2:00 UTC",North America
Trust Gaming vs PACT,Challenger League Season 9 Europe,"Monday, Mar 25 2019, 21:00 UTC",Europe
Evil Geniuses vs Rogue,Pro League Season 9 North America,"Tuesday, Mar 26 2019, 0:00 UTC",North America
Rise Nation vs Team Reciprocity,Pro League Season 9 North America,"Tuesday, Mar 26 2019, 1:00 UTC",North America
Spacestation Gaming vs DarkZero Esports,Pro League Season 9 North America,"Tuesday, Mar 26 2019, 2:00 UTC",North America
Mindfreak vs TBD,Pro League Season 9 Australia & New Zealand,"Wednesday, Mar 27 2019, 8:00 UTC",Australia & New Zealand
Fnatic vs 0RGL3SS,Pro League Season 9 Australia & New Zealand,"Wednesday, Mar 27 2019, 8:00 UTC",Australia & New Zealand
Fnatic vs 0RGL3SS,Pro League Season 9 Australia & New Zealand,"Wednesday, Mar 27 2019, 8:00 UTC",Australia & New Zealand
NORA-Rengo vs Sengoku,Pro League Season 9 Japan,"Wednesday, Mar 27 2019, 12:00 UTC",Japan
Oddity Esports vs Ex Nihilo,Pro League Season 9 Australia & New Zealand,"Wednesday, Mar 27 2019, 9:30 UTC",Australia & New Zealand
Mindfreak vs TBD,Pro League Season 9 Australia & New Zealand,"Wednesday, Mar 27 2019, 8:00 UTC",Australia & New Zealand
NORA-Rengo vs Sengoku,Pro League Season 9 Japan,"Wednesday, Mar 27 2019, 12:00 UTC",Japan
Oddity Esports vs Ex Nihilo,Pro League Season 9 Australia & New Zealand,"Wednesday, Mar 27 2019, 9:30 UTC",Australia & New Zealand
FAV Gaming vs Father's Back,Pro League Season 9 Japan,"Wednesday, Mar 27 2019, 12:00 UTC",Japan
FAV Gaming vs Father's Back,Pro League Season 9 Japan,"Wednesday, Mar 27 2019, 13:00 UTC",Japan
CYCLOPS athlete gaming vs SCARZ,Pro League Season 9 Japan,"Wednesday, Mar 27 2019, 13:30 UTC",Japan
0RGL3SS vs Extricity,Oceanic Cup 2019,"Friday, Mar 22 2019, 23:00 UTC","LAN,"
Oddity Esports vs Avant Gaming,Pro League Season 9 Australia & New Zealand,"Thursday, Mar 21 2019, 9:15 UTC",Australia & New Zealand
Oddity Esports vs Avant Gaming,Pro League Season 9 Australia & New Zealand,"Thursday, Mar 21 2019, 10:30 UTC",Australia & New Zealand
CYCLOPS athlete gaming vs AFFLICT ReV,Pro League Season 9 Japan,"Thursday, Mar 21 2019, 14:15 UTC",Japan
Team Secret vs LeStream Esport,Pro League Season 9 Europe,"Friday, Mar 22 2019, 18:00 UTC",Europe
G2 Esports vs Mousesports,Pro League Season 9 Europe,"Friday, Mar 22 2019, 20:00 UTC",Europe
Natus Vincere vs Team Empire,Pro League Season 9 Europe,"Friday, Mar 22 2019, 19:00 UTC",Europe
PENTA Sports vs Chaos,Pro League Season 9 Europe,"Friday, Mar 22 2019, 21:00 UTC",Europe
CYCLOPS athlete gaming vs AFFLICT ReV,Pro League Season 9 Japan,"Thursday, Mar 21 2019, 13:30 UTC",Japan
Disrupt Gaming vs Tune 6quad,Challenger League Season 9 North America,"Saturday, Mar 23 2019, 0:00 UTC",North America
Vicious Gaming vs Organized Chaos,Challenger League Season 9 North America,"Saturday, Mar 23 2019, 0:00 UTC",North America
Scillas Guerillas vs Soniqs,Challenger League Season 9 North America,"Saturday, Mar 23 2019, 1:00 UTC",North America
Bittersweet vs Altis Police Department,CCS Season 4 North America,"Saturday, Mar 23 2019, 0:00 UTC",North America
Team Reciprocity vs Ocean Creatures,CCS Season 4 North America,"Saturday, Mar 23 2019, 2:00 UTC",North America
Ex Nihilo vs Fnatic,Oceanic Cup 2019,"Saturday, Mar 23 2019, 2:00 UTC","LAN,"
Our Bad vs Elevate,Challenger League Season 9 North America,"Saturday, Mar 23 2019, 1:00 UTC",North America
Scillas Guerillas vs Elevate,Challenger League Season 9 North America,"Saturday, Mar 23 2019, 2:00 UTC",North America
Nemesis Esports vs SiNister Academy,CCS Season 4 North America,"Thursday, Mar 21 2019, 2:00 UTC",North America
MADZETES vs WP Gaming,Challenger League Season 9 Latin America,"Saturday, Mar 16 2019, 22:00 UTC",Latin America
Our Bad vs Tune 6quad,Challenger League Season 9 North America,"Saturday, Mar 16 2019, 3:00 UTC",North America
SemOrg Team vs Team oNe Esports,Challenger League Season 9 Latin America,"Saturday, Mar 16 2019, 22:00 UTC",Latin America
Lowkey Esports vs SG e-sports,Challenger League Season 9 Latin America,"Saturday, Mar 16 2019, 22:00 UTC",Latin America
SemOrg Team vs Team oNe Esports,Challenger League Season 9 Latin America,"Saturday, Mar 16 2019, 22:00 UTC",Latin America
Guidance Gaming vs YeaH Gaming,Challenger League Season 9 Latin America,"Saturday, Mar 16 2019, 22:00 UTC",Latin America
MADZETES vs WP Gaming,Challenger League Season 9 Latin America,"Saturday, Mar 16 2019, 23:00 UTC",Latin America
Guidance Gaming vs YeaH Gaming,Challenger League Season 9 Latin America,"Saturday, Mar 16 2019, 23:00 UTC",Latin America
Dizlown vs Unnamed,CCS Season 4 Europe,"Monday, Mar 18 2019, 18:00 UTC",Europe
INTZ e-Sports vs Pain Gaming,Brasileirão 2019,"Sunday, Mar 17 2019, 21:00 UTC","LAN,"
Lowkey Esports vs SG e-sports,Challenger League Season 9 Latin America,"Saturday, Mar 16 2019, 23:00 UTC",Latin America
Black Dragons vs Red Devils e-Sports,Brasileirão 2019,"Sunday, Mar 17 2019, 23:00 UTC","LAN,"
XTreme Video vs Team Vitality,Challenger League Season 9 Europe,"Monday, Mar 18 2019, 19:00 UTC",Europe
MnM Gaming vs Trust Gaming,Challenger League Season 9 Europe,"Monday, Mar 18 2019, 18:00 UTC",Europe
ex-NYYRIKKI vs PACT,Challenger League Season 9 Europe,"Monday, Mar 18 2019, 18:00 UTC",Europe
Supremacy vs EnD Gaming,Challenger League Season 9 Europe,"Monday, Mar 18 2019, 19:00 UTC",Europe
ex-NYYRIKKI vs EnD Gaming,Challenger League Season 9 Europe,"Monday, Mar 11 2019, 21:00 UTC",Europe
MnM Gaming vs Team Vitality,Challenger League Season 9 Europe,"Monday, Mar 11 2019, 21:00 UTC",Europe
Supremacy vs PACT,Challenger League Season 9 Europe,"Monday, Mar 11 2019, 20:00 UTC",Europe
DarkZero Esports vs Team Reciprocity,Pro League Season 9 North America,"Tuesday, Mar 12 2019, 0:00 UTC",North America
Spacestation Gaming vs Rise Nation,Pro League Season 9 North America,"Tuesday, Mar 12 2019, 1:00 UTC",North America
Rogue vs Excelerate Gaming,Pro League Season 9 North America,"Tuesday, Mar 12 2019, 2:00 UTC",North America
Fnatic vs Oddity Esports,Pro League Season 9 Australia & New Zealand,"Wednesday, Mar 13 2019, 9:00 UTC",Australia & New Zealand
Fnatic vs Oddity Esports,Pro League Season 9 Australia & New Zealand,"Wednesday, Mar 13 2019, 8:00 UTC",Australia & New Zealand
0RGL3SS vs ex-Darkside,Pro League Season 9 Australia & New Zealand,"Wednesday, Mar 13 2019, 10:00 UTC",Australia & New Zealand
0RGL3SS vs ex-Darkside,Pro League Season 9 Australia & New Zealand,"Wednesday, Mar 13 2019, 11:00 UTC",Australia & New Zealand
NORA-Rengo vs CYCLOPS athlete gaming,Pro League Season 9 Japan,"Wednesday, Mar 13 2019, 12:00 UTC",Japan
Sengoku vs FAV Gaming,Pro League Season 9 Japan,"Wednesday, Mar 13 2019, 15:00 UTC",Japan
Supremacy vs Nordik Esport,CCS Season 4 Europe,"Wednesday, Mar 13 2019, 17:00 UTC",Europe
XTreme Video vs Unnamed,CCS Season 4 Europe,"Wednesday, Mar 13 2019, 19:00 UTC",Europe
Sengoku vs FAV Gaming,Pro League Season 9 Japan,"Wednesday, Mar 13 2019, 14:00 UTC",Japan
NORA-Rengo vs CYCLOPS athlete gaming,Pro League Season 9 Japan,"Wednesday, Mar 13 2019, 13:00 UTC",Japan
FaZe Clan vs Ninjas In Pyjamas,Pro League Season 9 Latin America,"Wednesday, Mar 13 2019, 22:00 UTC",Latin America
Immortals vs Team Liquid,Pro League Season 9 Latin America,"Thursday, Mar 14 2019, 0:00 UTC",Latin America
INTZ e-Sports vs Pain Gaming,Pro League Season 9 Latin America,"Wednesday, Mar 13 2019, 21:00 UTC",Latin America
Global Breakout vs Organized Chaos,CCS Season 4 North America,"Thursday, Mar 14 2019, 0:00 UTC",North America
Rogue vs Spacestation Gaming,Six Invitational 2019,"Monday, Feb 11 2019, 18:00 UTC","LAN,"
Black Dragons vs Red Devils e-Sports,Pro League Season 9 Latin America,"Wednesday, Mar 13 2019, 23:00 UTC",Latin America
Team Liquid vs Mock-it-Esports,Six Invitational 2019,"Monday, Feb 11 2019, 20:40 UTC","LAN,"
G2 Esports vs Mantis FPS,Six Invitational 2019,"Monday, Feb 11 2019, 20:40 UTC","LAN,"
PENTA Sports vs NORA-Rengo,Six Invitational 2019,"Monday, Feb 11 2019, 23:30 UTC","LAN,"
Ninjas In Pyjamas vs Team Reciprocity,Six Invitational 2019,"Tuesday, Feb 12 2019, 15:10 UTC","LAN,"
FaZe Clan vs Fnatic,Six Invitational 2019,"Tuesday, Feb 12 2019, 15:10 UTC","LAN,"
Evil Geniuses vs LeStream Esport,Six Invitational 2019,"Monday, Feb 11 2019, 23:30 UTC","LAN,"
Rogue vs Immortals,Six Invitational 2019,"Tuesday, Feb 12 2019, 18:00 UTC","LAN,"
Spacestation Gaming vs Team Empire,Six Invitational 2019,"Tuesday, Feb 12 2019, 18:00 UTC","LAN,"
Team Liquid vs Mantis FPS,Six Invitational 2019,"Tuesday, Feb 12 2019, 22:10 UTC","LAN,"
Evil Geniuses vs NORA-Rengo,Six Invitational 2019,"Tuesday, Feb 12 2019, 23:30 UTC","LAN,"
LeStream Esport vs PENTA Sports,Six Invitational 2019,"Tuesday, Feb 12 2019, 23:30 UTC","LAN,"
G2 Esports vs Mock-it-Esports,Six Invitational 2019,"Tuesday, Feb 12 2019, 20:40 UTC","LAN,"
Spacestation Gaming vs Immortals,Six Invitational 2019,"Wednesday, Feb 13 2019, 18:00 UTC","LAN,"
Team Reciprocity vs FaZe Clan,Six Invitational 2019,"Wednesday, Feb 13 2019, 15:10 UTC","LAN,"
Team Liquid vs Mock-it-Esports,Six Invitational 2019,"Wednesday, Feb 13 2019, 20:40 UTC","LAN,"
PENTA Sports vs NORA-Rengo,Six Invitational 2019,"Wednesday, Feb 13 2019, 23:30 UTC","LAN,"
DarkZero Esports vs Team Reciprocity,Pro League Season 9 North America,"Wednesday, Jan 30 2019, 1:00 UTC",North America
Fnatic vs NORA-Rengo,Six Invitational 2019,"Friday, Feb 15 2019, 15:00 UTC","LAN,"
Spacestation Gaming vs Excelerate Gaming,Pro League Season 9 North America,"Tuesday, Jan 29 2019, 4:00 UTC",North America
Evil Geniuses vs OrgLess,Pro League Season 9 North America,"Wednesday, Jan 30 2019, 3:00 UTC",North America
Rogue vs Excelerate Gaming,Pro League Season 9 North America,"Wednesday, Jan 30 2019, 4:00 UTC",North America
Spacestation Gaming vs Rise Nation,Pro League Season 9 North America,"Wednesday, Jan 30 2019, 2:00 UTC",North America
Xavier Esports vs Ferox E-Sports,Pro League Season 9 South-East Asia,"Wednesday, Jan 30 2019, 11:00 UTC",South-East Asia
0RGL3SS vs Oddity Esports,Pro League Season 9 Australia & New Zealand,"Wednesday, Jan 30 2019, 8:00 UTC",Australia & New Zealand
Xavier Esports vs Ferox E-Sports,Pro League Season 9 South-East Asia,"Wednesday, Jan 30 2019, 12:00 UTC",South-East Asia
Aerowolf vs Team DAD1,Pro League Season 9 South-East Asia,"Wednesday, Jan 30 2019, 14:00 UTC",South-East Asia
0RGL3SS vs Oddity Esports,Pro League Season 9 Australia & New Zealand,"Wednesday, Jan 30 2019, 9:00 UTC",Australia & New Zealand
Aerowolf vs Team DAD1,Pro League Season 9 South-East Asia,"Wednesday, Jan 30 2019, 13:00 UTC",South-East Asia
NORA-Rengo vs Rsk Ninja Gaming,Pro League Season 9 Japan,"Wednesday, Jan 30 2019, 12:00 UTC",Japan
Sengoku vs CYCLOPS athlete gaming,Pro League Season 9 Japan,"Wednesday, Jan 30 2019, 14:00 UTC",Japan
Xavier Esports vs INTelligent YesTag,Pro League Season 9 South-East Asia,"Thursday, Jan 24 2019, 12:00 UTC",South-East Asia
NORA-Rengo vs ReV,Pro League Season 9 Japan,"Thursday, Jan 24 2019, 13:00 UTC",Japan
Aerowolf vs Ferox E-Sports,Pro League Season 9 South-East Asia,"Thursday, Jan 24 2019, 13:00 UTC",South-East Asia
NORA-Rengo vs ReV,Pro League Season 9 Japan,"Thursday, Jan 24 2019, 12:00 UTC",Japan
Sengoku vs Rsk Ninja Gaming,Pro League Season 9 Japan,"Thursday, Jan 24 2019, 14:00 UTC",Japan
NORA-Rengo vs Rsk Ninja Gaming,Pro League Season 9 Japan,"Wednesday, Jan 30 2019, 13:00 UTC",Japan
Sengoku vs Rsk Ninja Gaming,Pro League Season 9 Japan,"Thursday, Jan 24 2019, 15:00 UTC",Japan
Aerowolf vs Ferox E-Sports,Pro League Season 9 South-East Asia,"Thursday, Jan 24 2019, 14:00 UTC",South-East Asia
Red Devils e-Sports vs Team Liquid,Pro League Season 9 Latin America,"Thursday, Jan 24 2019, 23:00 UTC",Latin America
0RGL3SS vs Gentlemen in Underwear,Pro League Season 9 Australia & New Zealand,"Friday, Jan 25 2019, 8:00 UTC",Australia & New Zealand
Ninjas In Pyjamas vs Pain Gaming,Pro League Season 9 Latin America,"Thursday, Jan 24 2019, 20:00 UTC",Latin America
MBT Impetus vs Generic Void eSports,Pro League Season 9 South-East Asia,"Friday, Jan 25 2019, 11:00 UTC",South-East Asia
Xavier Esports vs INTelligent YesTag,Pro League Season 9 South-East Asia,"Thursday, Jan 24 2019, 11:00 UTC",South-East Asia
Immortals vs Black Dragons,Pro League Season 9 Latin America,"Thursday, Jan 24 2019, 21:00 UTC",Latin America
FaZe Clan vs INTZ e-Sports,Pro League Season 9 Latin America,"Thursday, Jan 24 2019, 22:00 UTC",Latin America
0RGL3SS vs Gentlemen in Underwear,Pro League Season 9 Australia & New Zealand,"Friday, Jan 25 2019, 9:00 UTC",Australia & New Zealand
Team Secret vs LeStream Esport,Pro League Season 9 Europe,"Friday, Jan 18 2019, 21:00 UTC",Europe
Black Dragons vs Team oNe Esports,Six Invitational 2019 Latin America Qualifiers,"Friday, Jan 18 2019, 22:15 UTC",Latin America
Spacestation Gaming vs OrgLess,Six Invitational 2019 North America Qualifiers,"Saturday, Jan 19 2019, 3:30 UTC",North America
PENTA Sports vs Chaos,Pro League Season 9 Europe,"Friday, Jan 18 2019, 19:00 UTC",Europe
Ninjas In Pyjamas vs Team Liquid,Six Invitational 2019 Latin America Qualifiers,"Saturday, Jan 19 2019, 20:00 UTC",Latin America
Team Empire vs Mock-it-Esports,Pro League Season 9 Europe,"Friday, Jan 18 2019, 20:00 UTC",Europe
Ninjas In Pyjamas vs Black Dragons,Six Invitational 2019 Latin America Qualifiers,"Saturday, Jan 19 2019, 23:00 UTC",Latin America
LeStream Esport vs Team Vitality,Six Invitational 2019 Europe Qualifiers,"Sunday, Jan 20 2019, 21:00 UTC",Europe
Team Liquid vs Red Devils e-Sports,Brasileirão 2019,"Sunday, Jan 20 2019, 20:00 UTC","LAN,"
Immortals vs INTZ e-Sports,Brasileirão 2019,"Sunday, Jan 20 2019, 22:00 UTC","LAN,"
LeStream Esport vs Team Empire,Six Invitational 2019 Europe Qualifiers,"Sunday, Jan 20 2019, 18:00 UTC",Europe
Rogue vs Team Reciprocity,Pro League Season 9 North America,"Tuesday, Jan 22 2019, 2:00 UTC",North America
Evil Geniuses vs Rise Nation,Pro League Season 9 North America,"Tuesday, Jan 22 2019, 1:00 UTC",North America
Spacestation Gaming vs OrgLess,Pro League Season 9 North America,"Tuesday, Jan 22 2019, 3:00 UTC",North America
DarkZero Esports vs Excelerate Gaming,Pro League Season 9 North America,"Tuesday, Jan 22 2019, 4:00 UTC",North America
Team Reciprocity vs OrgLess,Pro League Season 9 North America,"Wednesday, Jan 23 2019, 1:00 UTC",North America
Immortals vs Pain Gaming,Pro League Season 9 Latin America,"Wednesday, Jan 16 2019, 20:00 UTC",Latin America
forZe vs Team Vitality,Six Invitational 2019 Europe Qualifiers,"Wednesday, Jan 16 2019, 21:00 UTC",Europe
FaZe Clan vs Red Devils e-Sports,Pro League Season 9 Latin America,"Wednesday, Jan 16 2019, 22:00 UTC",Latin America
Ninjas In Pyjamas vs Black Dragons,Pro League Season 9 Latin America,"Wednesday, Jan 16 2019, 21:00 UTC",Latin America
Spacestation Gaming vs Rise Nation,Six Invitational 2019 North America Qualifiers,"Thursday, Jan 17 2019, 3:00 UTC",North America
Fnatic vs Mindfreak,Pro League Season 9 Australia & New Zealand,"Thursday, Jan 17 2019, 8:00 UTC",Australia & New Zealand
INTZ e-Sports vs Team Liquid,Pro League Season 9 Latin America,"Wednesday, Jan 16 2019, 23:00 UTC",Latin America
Fnatic vs Mindfreak,Pro League Season 9 Australia & New Zealand,"Thursday, Jan 17 2019, 9:00 UTC",Australia & New Zealand
Excelerate Gaming vs Spacestation Gaming,Six Invitational 2019 North America Qualifiers,"Thursday, Jan 17 2019, 0:00 UTC",North America
Scrypt vs INTelligent YesTag,Pro League Season 9 South-East Asia,"Thursday, Jan 17 2019, 11:00 UTC",South-East Asia
Oddity Esports vs Lowkey Cardinal,Pro League Season 9 Australia & New Zealand,"Thursday, Jan 17 2019, 11:00 UTC",Australia & New Zealand
Oddity Esports vs Lowkey Cardinal,Pro League Season 9 Australia & New Zealand,"Thursday, Jan 17 2019, 10:00 UTC",Australia & New Zealand
FAV Gaming vs ReV,Pro League Season 9 Japan,"Thursday, Jan 17 2019, 12:00 UTC",Japan
Team DAD1 vs Ferox E-Sports,Pro League Season 9 South-East Asia,"Thursday, Jan 17 2019, 13:00 UTC",South-East Asia
Scrypt vs INTelligent YesTag,Pro League Season 9 South-East Asia,"Thursday, Jan 17 2019, 12:00 UTC",South-East Asia
FAV Gaming vs ReV,Pro League Season 9 Japan,"Thursday, Jan 17 2019, 13:00 UTC",Japan
Least Wanted vs Elephant Gang,Six Invitational 2019 North America Qualifiers,"Wednesday, Jan 16 2019, 19:00 UTC",North America
Chaos vs KaYEET,Six Invitational 2019 Europe Qualifiers,"Monday, Jan 14 2019, 19:00 UTC",Europe
Keyd Stars vs Ninjas In Pyjamas,Six Invitational 2019 Latin America Qualifiers,"Monday, Jan 14 2019, 21:00 UTC",Latin America
Pain Gaming vs Team oNe Esports,Six Invitational 2019 Latin America Qualifiers,"Monday, Jan 14 2019, 21:00 UTC",Latin America
Team Vitality vs LeStream Esport,Six Invitational 2019 Europe Qualifiers,"Monday, Jan 14 2019, 23:00 UTC",Europe
PACT vs ENCE eSports,Six Invitational 2019 Europe Qualifiers,"Monday, Jan 14 2019, 22:00 UTC",Europe
Guidance Gaming vs Black Dragons,Six Invitational 2019 Latin America Qualifiers,"Monday, Jan 14 2019, 23:00 UTC",Latin America
DarkZero Esports vs Spacestation Gaming,Pro League Season 9 North America,"Tuesday, Jan 15 2019, 3:00 UTC",North America
Excelerate Gaming vs OrgLess,Pro League Season 9 North America,"Tuesday, Jan 15 2019, 2:00 UTC",North America
Taichou vs Team SiNister,Six Invitational 2019 North America Qualifiers,"Tuesday, Jan 15 2019, 1:00 UTC",North America
Rogue vs Evil Geniuses,Pro League Season 9 North America,"Tuesday, Jan 15 2019, 1:00 UTC",North America
Team Vitality vs PACT,Six Invitational 2019 Europe Qualifiers,"Tuesday, Jan 15 2019, 18:00 UTC",Europe
Chaos vs Supremacy,Six Invitational 2019 Europe Qualifiers,"Tuesday, Jan 15 2019, 19:00 UTC",Europe
Team Secret vs LeStream Esport,Six Invitational 2019 Europe Qualifiers,"Tuesday, Jan 15 2019, 19:00 UTC",Europe
Team Reciprocity vs Rise Nation,Pro League Season 9 North America,"Tuesday, Jan 15 2019, 4:00 UTC",North America
XTreme Video vs Team Vitality,Six Invitational 2019 Europe Qualifiers,"Tuesday, Jan 15 2019, 19:00 UTC",Europe
XTreme Video vs Team Empire,Six Invitational 2019 Europe Qualifiers,"Tuesday, Jan 15 2019, 19:00 UTC",Europe
XTreme Video vs oui oui,Six Invitational 2019 Europe Qualifiers,"Tuesday, Jan 15 2019, 19:00 UTC",Europe
iDomina Esports NA vs Regime,CCS Season 4 North America,"Thursday, Dec 20 2018, 1:00 UTC",North America
DeathroW vs Unnamed,CCS Season 4 Europe,"Wednesday, Dec 19 2018, 20:00 UTC",Europe
Rise Nation vs SiNister Academy,CCS Season 4 North America,"Saturday, Dec 22 2018, 1:00 UTC",North America
Cloud9 vs Polarace Esports,CCS Season 4 North America,"Thursday, Dec 20 2018, 3:00 UTC",North America
Yellow on Ash vs ex-Noble esports,CCS Season 4 North America,"Saturday, Dec 22 2018, 3:00 UTC",North America
Team Instinct vs Epsilon eSports,CCS Season 4 Europe,"Thursday, Dec 20 2018, 18:00 UTC",Europe
Black Dragons vs INTZ e-Sports,Brasileirão 2019,"Sunday, Jan 6 2019, 20:00 UTC","LAN,"
Immortals vs Red Devils e-Sports,Brasileirão 2019,"Sunday, Jan 6 2019, 22:00 UTC","LAN,"
Team Reciprocity vs Excelerate Gaming,Pro League Season 9 North America,"Wednesday, Jan 9 2019, 1:00 UTC",North America
DarkZero Esports vs Rise Nation,Pro League Season 9 North America,"Wednesday, Jan 9 2019, 4:00 UTC",North America
Rogue vs OrgLess,Pro League Season 9 North America,"Wednesday, Jan 9 2019, 3:00 UTC",North America
INTZ e-Sports vs Ninjas In Pyjamas,Pro League Season 9 Latin America,"Wednesday, Jan 9 2019, 21:00 UTC",Latin America
FaZe Clan vs Pain Gaming,Pro League Season 9 Latin America,"Wednesday, Jan 9 2019, 22:00 UTC",Latin America
Black Dragons vs Team Liquid,Pro League Season 9 Latin America,"Wednesday, Jan 9 2019, 20:00 UTC",Latin America
G2 Esports vs Mock-it-Esports,Pro League Season 9 Europe,"Thursday, Jan 10 2019, 18:00 UTC",Europe
Immortals vs Red Devils e-Sports,Pro League Season 9 Latin America,"Wednesday, Jan 9 2019, 23:00 UTC",Latin America
Team Liquid vs Trust Gaming,DreamHack Winter 2018,"Saturday, Dec 1 2018, 16:00 UTC","LAN,"
LeStream Esport vs PACT,DreamHack Winter 2018,"Saturday, Dec 1 2018, 16:00 UTC","LAN,"
Spacestation Gaming vs Evil Geniuses,Pro League Season 9 North America,"Wednesday, Jan 9 2019, 2:00 UTC",North America
PENTA Sports vs NYYRIKKI Esports,DreamHack Winter 2018,"Saturday, Dec 1 2018, 16:00 UTC","LAN,"
Spacestation Gaming vs Mock-it-Esports,DreamHack Winter 2018,"Saturday, Dec 1 2018, 19:30 UTC","LAN,"
Team Empire vs PACT,DreamHack Winter 2018,"Saturday, Dec 1 2018, 19:30 UTC","LAN,"
Chaos vs PENTA Sports,DreamHack Winter 2018,"Saturday, Dec 1 2018, 19:30 UTC","LAN,"
G2 Esports vs Team Liquid,DreamHack Winter 2018,"Saturday, Dec 1 2018, 20:30 UTC","LAN,"
Team Empire vs Spacestation Gaming,DreamHack Winter 2018,"Sunday, Dec 2 2018, 15:30 UTC","LAN,"
Spacestation Gaming vs PENTA Sports,DreamHack Winter 2018,"Sunday, Dec 2 2018, 13:40 UTC","LAN,"
G2 Esports vs Team Empire,DreamHack Winter 2018,"Sunday, Dec 2 2018, 10:00 UTC","LAN,"
G2 Esports vs PENTA Sports,DreamHack Winter 2018,"Sunday, Dec 2 2018, 15:30 UTC","LAN,"
Epsilon eSports vs La Rascasse,CCS Season 4 Europe,"Monday, Dec 3 2018, 20:00 UTC",Europe
Team Empire vs Unnamed,CCS Season 4 Europe,"Wednesday, Dec 5 2018, 18:00 UTC",Europe
Team Instinct vs DeathroW,CCS Season 4 Europe,"Wednesday, Dec 5 2018, 20:00 UTC",Europe
Altis Police Department vs Regime,CCS Season 4 North America,"Saturday, Dec 8 2018, 1:00 UTC",North America
Cloud9 vs SiNister Academy,CCS Season 4 North America,"Thursday, Dec 6 2018, 3:00 UTC",North America
ex-Noble esports vs Rise Nation,CCS Season 4 North America,"Thursday, Dec 6 2018, 1:00 UTC",North America
Yellow on Ash vs iDomina Esports NA,CCS Season 4 North America,"Saturday, Dec 8 2018, 3:00 UTC",North America
Supremacy vs Team Vitality,CCS Season 4 Europe,"Monday, Dec 3 2018, 18:00 UTC",Europe
MnM Gaming vs Cryptick Gaming,Benelux League Season 2,"Wednesday, Nov 7 2018, 20:00 UTC",Europe
Demise vs Flash Point,Benelux League Season 2,"Wednesday, Oct 31 2018, 18:00 UTC",Europe
OG Squad vs MnM Gaming,Benelux League Season 2,"Wednesday, Oct 31 2018, 20:00 UTC",Europe
Auxilium vs Cryptick Gaming,Benelux League Season 2,"Wednesday, Oct 31 2018, 20:00 UTC",Europe
Pain Gaming vs Team oNe Esports,Brasileirão 2019,"Sunday, Nov 4 2018, 20:00 UTC","LAN,"
Trust Gaming vs DiversityGG,Benelux League Season 2,"Wednesday, Oct 31 2018, 18:00 UTC",Europe
NobleGG vs Elephant Gang,Pro League Season 8 North America,"Tuesday, Nov 6 2018, 2:00 UTC",North America
Pain Gaming vs Guidance Gaming,Pro League Season 8 Latin America,"Saturday, Nov 3 2018, 1:00 UTC",Latin America
Flash Point vs DiversityGG,Benelux League Season 2,"Wednesday, Nov 7 2018, 18:00 UTC",Europe
Team Liquid vs Immortals,Brasileirão 2019,"Sunday, Nov 4 2018, 22:00 UTC","LAN,"
Trust Gaming vs Demise,Benelux League Season 2,"Wednesday, Nov 7 2018, 18:00 UTC",Europe
Auxilium vs OG Squad,Benelux League Season 2,"Wednesday, Nov 7 2018, 20:00 UTC",Europe
Ninjas In Pyjamas vs Pain Gaming,Brasileirão 2019,"Sunday, Nov 11 2018, 22:00 UTC","LAN,"
Team Vitality vs ENCE eSports,Pro League Season 8 Europe,"Thursday, Nov 8 2018, 21:00 UTC",Europe
FaZe Clan vs Red Devils e-Sports,Brasileirão 2019,"Sunday, Nov 11 2018, 20:00 UTC","LAN,"
Ninjas In Pyjamas vs Red Devils e-Sports,Brasileirão 2019,"Sunday, Oct 28 2018, 23:00 UTC","LAN,"
Spacestation Gaming vs Mousesports,Pro League Season 8 North America,"Tuesday, Oct 16 2018, 1:00 UTC",North America
NobleGG vs Cloud9,Pro League Season 8 North America,"Tuesday, Oct 16 2018, 0:00 UTC",North America
Evil Geniuses vs SK Gaming,Pro League Season 8 North America,"Tuesday, Oct 16 2018, 2:00 UTC",North America
DiversityGG vs Auxilium,Benelux League Season 2,"Wednesday, Oct 17 2018, 17:00 UTC",Europe
Trust Gaming vs Cryptick Gaming,Benelux League Season 2,"Wednesday, Oct 17 2018, 17:00 UTC",Europe
Flash Point vs OG Squad,Benelux League Season 2,"Wednesday, Oct 17 2018, 19:00 UTC",Europe
Demise vs MnM Gaming,Benelux League Season 2,"Wednesday, Oct 17 2018, 19:00 UTC",Europe
Rogue vs Obey Alliance,Pro League Season 8 North America,"Tuesday, Oct 16 2018, 3:00 UTC",North America
Team Liquid vs FaZe Clan,Pro League Season 8 Latin America,"Wednesday, Oct 17 2018, 23:00 UTC",Latin America
Pain Gaming vs Ninjas In Pyjamas,Pro League Season 8 Latin America,"Wednesday, Oct 17 2018, 22:00 UTC",Latin America
