title,competation,time,country
Team oNe Esports vs Team SoloMid,DreamHack Valencia 2019,"Friday, Jul 5 2019, 14:25 UTC","LAN,"
0RGL3SS vs Oddity Esports,Six Masters 2019,"Saturday, Jul 6 2019, 7:00 UTC",Australia & New Zealand
PENTA Sports vs Team MCES,DreamHack Valencia 2019,"Friday, Jul 5 2019, 17:50 UTC","LAN,"
Looking for Org. vs Vodafone Giants,DreamHack Valencia 2019,"Friday, Jul 5 2019, 17:50 UTC","LAN,"
Team Reciprocity vs Team SoloMid,DreamHack Valencia 2019,"Saturday, Jul 6 2019, 8:00 UTC","LAN,"
Rogue vs Looking for Org.,DreamHack Valencia 2019,"Saturday, Jul 6 2019, 8:00 UTC","LAN,"
FaZe Clan vs Team Vitality,DreamHack Valencia 2019,"Saturday, Jul 6 2019, 8:00 UTC","LAN,"
Mindfreak vs Rhythm,Six Masters 2019,"Sunday, Jul 7 2019, 10:00 UTC",Australia & New Zealand
PENTA Sports vs Chaos,DreamHack Valencia 2019,"Saturday, Jul 6 2019, 8:00 UTC","LAN,"
FaZe Clan vs Chaos,DreamHack Valencia 2019,"Sunday, Jul 7 2019, 15:30 UTC","LAN,"
Cloud9 vs x6tence,DreamHack Valencia 2019,"Saturday, Jul 6 2019, 11:25 UTC","LAN,"
Looking for Org. vs Rogue,DreamHack Valencia 2019,"Sunday, Jul 7 2019, 15:30 UTC","LAN,"
Disrupt Gaming vs Team Boosted,United States Nationals 2019,"Wednesday, Jul 10 2019, 1:00 UTC",North America
Two Faced vs Disrupt Gaming,United States Nationals 2019,"Wednesday, Jul 10 2019, 2:00 UTC",North America
Team SiNister vs Zealous,Six Masters 2019,"Saturday, Jul 6 2019, 10:00 UTC",Australia & New Zealand
Pain Gaming vs Immortals,Brasileirão 2019,"Sunday, Jul 7 2019, 21:00 UTC","LAN,"
Our Bad vs Two Faced,United States Nationals 2019,"Wednesday, Jul 10 2019, 0:00 UTC",North America
INTZ e-Sports vs Red Devils e-Sports,Brasileirão 2019,"Sunday, Jul 7 2019, 23:00 UTC","LAN,"
FaZe Clan vs Looking for Org.,DreamHack Valencia 2019,"Sunday, Jul 7 2019, 12:00 UTC","LAN,"
Unsold Stuff Gaming vs Lamy Wonderland,Pro League Season 10 Japan,"Wednesday, Jul 10 2019, 12:00 UTC",Japan
Zealous vs Oddity Esports,Pro League Season 10 Australia & New Zealand,"Wednesday, Jul 10 2019, 13:00 UTC",Australia & New Zealand
Oddity Esports vs Zealous,Pro League Season 10 Australia & New Zealand,"Wednesday, Jul 10 2019, 12:00 UTC",Australia & New Zealand
Unsold Stuff Gaming vs Lamy Wonderland,Pro League Season 10 Japan,"Wednesday, Jul 10 2019, 13:00 UTC",Japan
Supremacy vs Bastille Legacy,6 French League Season 1,"Wednesday, Jul 10 2019, 17:30 UTC",Europe
Red Devils e-Sports vs Team Liquid,Pro League Season 10 Latin America,"Wednesday, Jul 10 2019, 19:30 UTC",Latin America
Black Dragons vs INTZ e-Sports,Pro League Season 10 Latin America,"Wednesday, Jul 10 2019, 18:15 UTC",Latin America
Looking for Org. vs Team Oplon,6 French League Season 1,"Wednesday, Jul 10 2019, 19:30 UTC",Europe
PENTA Sports vs Team MCES,6 French League Season 1,"Wednesday, Jul 10 2019, 20:30 UTC",Europe
FAV Gaming vs DetonatioN Gaming,Pro League Season 10 Japan,"Wednesday, Jul 10 2019, 14:00 UTC",Japan
Team Vitality vs GameWard Team,6 French League Season 1,"Wednesday, Jul 10 2019, 18:30 UTC",Europe
Team oNe Esports vs FaZe Clan,Pro League Season 10 Latin America,"Wednesday, Jul 10 2019, 17:00 UTC",Latin America
x6tence vs forZe,Six Major Raleigh Europe Qualifiers,"Thursday, Jul 11 2019, 17:00 UTC",Europe
FAV Gaming vs DetonatioN Gaming,Pro League Season 10 Japan,"Wednesday, Jul 10 2019, 15:00 UTC",Japan
Ninjas In Pyjamas vs Immortals,Pro League Season 10 Latin America,"Wednesday, Jul 10 2019, 20:45 UTC",Latin America
PENTA Sports vs eWorld in Progress,Six Major Raleigh Europe Qualifiers,"Thursday, Jul 11 2019, 17:00 UTC",Europe
INTZ e-Sports vs Red Devils e-Sports,Six Major Raleigh Latin America Qualifiers,"Thursday, Jul 11 2019, 0:00 UTC",Latin America
Team Heretics vs Team GamerLegion,Six Major Raleigh Europe Qualifiers,"Thursday, Jul 11 2019, 20:00 UTC",Europe
Mkers vs Don't Panic,Six Major Raleigh Europe Qualifiers,"Thursday, Jul 11 2019, 20:00 UTC",Europe
x6tence vs PENTA Sports,Six Major Raleigh Europe Qualifiers,"Thursday, Jul 11 2019, 20:00 UTC",Europe
KKona KKopteri vs GameWard Team,Six Major Raleigh Europe Qualifiers,"Thursday, Jul 11 2019, 20:00 UTC",Europe
OrgLess vs Chaos,Six Major Raleigh Europe Qualifiers,"Thursday, Jul 11 2019, 20:00 UTC",Europe
Team Vitality vs Natus Vincere,Six Major Raleigh Europe Qualifiers,"Thursday, Jul 11 2019, 20:00 UTC",Europe
Rise Nation vs Pittsburgh Embers,Six Major Raleigh North America Qualifiers,"Friday, Jul 12 2019, 0:00 UTC",North America
ZooM9 E-sports vs INTZ e-Sports,Six Major Raleigh Latin America Qualifiers,"Thursday, Jul 11 2019, 22:00 UTC",Latin America
forZe vs eWorld in Progress,Six Major Raleigh Europe Qualifiers,"Thursday, Jul 11 2019, 20:00 UTC",Europe
Ice Walk vs Ninjas In Pyjamas,Six Major Raleigh Latin America Qualifiers,"Thursday, Jul 11 2019, 22:00 UTC",Latin America
GiFu eSports vs BDS Esport,Six Major Raleigh Europe Qualifiers,"Thursday, Jul 11 2019, 20:00 UTC",Europe
Red Devils e-Sports vs MyP,Six Major Raleigh Latin America Qualifiers,"Thursday, Jul 11 2019, 22:00 UTC",Latin America
Luminosity Gaming vs Shrug,Six Major Raleigh North America Qualifiers,"Friday, Jul 12 2019, 0:00 UTC",North America
Spacestation Gaming vs Our Bad,Six Major Raleigh North America Qualifiers,"Friday, Jul 12 2019, 0:00 UTC",North America
Disrupt Gaming vs Leftovers,Six Major Raleigh North America Qualifiers,"Friday, Jul 12 2019, 0:00 UTC",North America
Guidance Gaming vs Ninjas In Pyjamas,Six Major Raleigh Latin America Qualifiers,"Friday, Jul 12 2019, 0:00 UTC",Latin America
Soniqs vs zqwe,Six Major Raleigh North America Qualifiers,"Friday, Jul 12 2019, 0:00 UTC",North America
S7venSpades vs Chips y Guac,United States Nationals 2019,"Friday, Jul 12 2019, 0:00 UTC",North America
Team SoloMid vs Attempt #,Six Major Raleigh North America Qualifiers,"Friday, Jul 12 2019, 0:00 UTC",North America
Immortals vs Red Devils e-Sports,Pro League Season 10 Latin America,"Saturday, Jul 13 2019, 1:45 UTC",Latin America
Disrupt Gaming vs Spacestation Gaming,Six Major Raleigh North America Qualifiers,"Saturday, Jul 13 2019, 2:30 UTC",North America
Oddity Esports vs Team SiNister,Six Masters 2019,"Saturday, Jul 13 2019, 4:00 UTC",Australia & New Zealand
0RGL3SS vs ACME Association,Six Masters 2019,"Saturday, Jul 13 2019, 7:00 UTC",Australia & New Zealand
Team 6ix vs PsykoPaths Gaming,Canada Nationals 2019,"Sunday, Jul 14 2019, 1:00 UTC",North America
LiViD Gaming vs Thread the Needle,Canada Nationals 2019,"Saturday, Jul 13 2019, 23:00 UTC",North America
Rhythm vs Sleeper Gaming,Six Masters 2019,"Sunday, Jul 14 2019, 7:00 UTC",Australia & New Zealand
Mindfreak vs Extricity,Six Masters 2019,"Sunday, Jul 14 2019, 10:00 UTC",Australia & New Zealand
Zealous vs Power Plays,Six Masters 2019,"Saturday, Jul 13 2019, 10:00 UTC",Australia & New Zealand
DarkZero Esports vs Rise Nation,United States Nationals 2019,"Friday, Jul 12 2019, 1:00 UTC",North America
PENTA Sports vs Team Vitality,Pro League Season 10 Europe,"Monday, Jul 15 2019, 16:00 UTC",Europe
Soniqs vs Leftovers,Six Major Raleigh North America Qualifiers,"Saturday, Jul 13 2019, 2:30 UTC",North America
Team Empire vs Natus Vincere,Pro League Season 10 Europe,"Monday, Jul 15 2019, 17:15 UTC",Europe
Fury vs Extricity,Six Masters 2019,"Sunday, Jul 14 2019, 4:00 UTC",Australia & New Zealand
Chaos vs GiFu eSports,Pro League Season 10 Europe,"Monday, Jul 15 2019, 18:30 UTC",Europe
Team Liquid vs INTZ e-Sports,Six Major Raleigh Latin America Qualifiers,"Monday, Jul 15 2019, 22:00 UTC",Latin America
Black Dragons vs Ninjas In Pyjamas,Six Major Raleigh Latin America Qualifiers,"Monday, Jul 15 2019, 22:00 UTC",Latin America
Team oNe Esports vs CHICOS Team,Six Major Raleigh Latin America Qualifiers,"Monday, Jul 15 2019, 22:00 UTC",Latin America
G2 Esports vs Looking for Org.,Pro League Season 10 Europe,"Monday, Jul 15 2019, 19:45 UTC",Europe
Father's Back vs Unsold Stuff Gaming,Pro League Season 10 Japan,"Wednesday, Jul 17 2019, 13:00 UTC",Japan
BDS Esport vs Natus Vincere,Six Major Raleigh Europe Qualifiers,"Wednesday, Jul 17 2019, 17:00 UTC",Europe
Father's Back vs Unsold Stuff Gaming,Pro League Season 10 Japan,"Wednesday, Jul 17 2019, 12:00 UTC",Japan
Natus Vincere vs Team Vitality,Six Major Raleigh Europe Qualifiers,"Wednesday, Jul 17 2019, 20:30 UTC",Europe
Team oNe Esports vs Red Devils e-Sports,Pro League Season 10 Latin America,"Wednesday, Jul 17 2019, 19:30 UTC",Latin America
Team Liquid vs Black Dragons,Pro League Season 10 Latin America,"Wednesday, Jul 17 2019, 20:45 UTC",Latin America
FaZe Clan vs Immortals,Pro League Season 10 Latin America,"Wednesday, Jul 17 2019, 18:15 UTC",Latin America
Ninjas In Pyjamas vs INTZ e-Sports,Pro League Season 10 Latin America,"Wednesday, Jul 17 2019, 17:00 UTC",Latin America
Team Vitality vs GiFu eSports,Six Major Raleigh Europe Qualifiers,"Wednesday, Jul 17 2019, 17:00 UTC",Europe
Team Reciprocity vs Spacestation Gaming,Six Major Raleigh North America Qualifiers,"Thursday, Jul 18 2019, 0:00 UTC",North America
Leftovers vs Spacestation Gaming,Six Major Raleigh North America Qualifiers,"Thursday, Jul 18 2019, 2:30 UTC",North America
Pittsburgh Embers vs Leftovers,Six Major Raleigh North America Qualifiers,"Wednesday, Jul 17 2019, 22:00 UTC",North America
Bastille Legacy vs GameWard Team,6 French League Season 1,"Thursday, Jul 18 2019, 20:00 UTC",Europe
Supremacy vs Team Oplon,6 French League Season 1,"Thursday, Jul 18 2019, 17:00 UTC",Europe
Team Vitality vs PENTA Sports,6 French League Season 1,"Thursday, Jul 18 2019, 18:00 UTC",Europe
Deja Vu vs Rise Nation,United States Nationals 2019,"Friday, Jul 19 2019, 0:00 UTC",North America
Looking for Org. vs Team MCES,6 French League Season 1,"Thursday, Jul 18 2019, 19:00 UTC",Europe
Rise Nation vs S7venSpades,United States Nationals 2019,"Friday, Jul 19 2019, 2:00 UTC",North America
Evil Geniuses vs Spacestation Gaming,Pro League Season 10 North America,"Tuesday, Jul 23 2019, 3:45 UTC",North America
Black Dragons vs Team oNe Esports,Six Major Raleigh Latin America Qualifiers,"Friday, Jul 19 2019, 1:00 UTC",Latin America
Luminosity Gaming vs Rogue,United States Nationals 2019,"Wednesday, Jul 24 2019, 0:00 UTC",North America
Disrupt Gaming vs Team SoloMid,United States Nationals 2019,"Wednesday, Jul 24 2019, 1:00 UTC",North America
Black Dragons vs Red Devils e-Sports,Six Major Raleigh Latin America Qualifiers,"Thursday, Jul 18 2019, 22:00 UTC",Latin America
forZe vs Team Vitality,Six Major Raleigh Europe Qualifiers,"Friday, Jul 19 2019, 16:00 UTC",Europe
Bastille Legacy vs Team Oplon,6 French League Season 1,"Wednesday, Jul 24 2019, 19:00 UTC",Europe
Chaos vs forZe,Six Major Raleigh Europe Qualifiers,"Friday, Jul 19 2019, 19:00 UTC",Europe
Team Vitality vs Looking for Org.,6 French League Season 1,"Wednesday, Jul 24 2019, 21:00 UTC",Europe
Team MCES vs Supremacy,6 French League Season 1,"Wednesday, Jul 24 2019, 20:00 UTC",Europe
GameWard Team vs PENTA Sports,6 French League Season 1,"Wednesday, Jul 24 2019, 18:00 UTC",Europe
DarkZero Esports vs Spacestation Gaming,United States Nationals 2019,"Friday, Jul 26 2019, 1:00 UTC",North America
Parallax Gaming vs Rise Nation,United States Nationals 2019,"Friday, Jul 26 2019, 0:00 UTC",North America
Oddity Esports vs Cryptik,Six Masters 2019,"Saturday, Jul 27 2019, 7:00 UTC",Australia & New Zealand
Ninjas In Pyjamas vs Black Dragons,Brasileirão 2019 Finals,"Friday, Jul 26 2019, 21:30 UTC","LAN,"
Chips y Guac vs S7venSpades,United States Nationals 2019,"Friday, Jul 19 2019, 1:00 UTC",North America
Team SiNister vs ACME Association,Six Masters 2019,"Saturday, Jul 27 2019, 4:00 UTC",Australia & New Zealand
Rhythm vs Extricity,Six Masters 2019,"Sunday, Jul 28 2019, 4:00 UTC",Australia & New Zealand
0RGL3SS vs Power Plays,Six Masters 2019,"Saturday, Jul 27 2019, 10:00 UTC",Australia & New Zealand
Thread the Needle vs PsykoPaths Gaming,Canada Nationals 2019,"Saturday, Jul 27 2019, 23:00 UTC",North America
FaZe Clan vs Ninjas In Pyjamas,Brasileirão 2019 Finals,"Saturday, Jul 27 2019, 21:30 UTC","LAN,"
Extricity vs Sleeper Gaming,Six Masters 2019,"Sunday, Jul 28 2019, 10:00 UTC",Australia & New Zealand
Team Liquid vs FaZe Clan,Brasileirão 2019 Finals,"Sunday, Jul 28 2019, 16:15 UTC","LAN,"
Team Oplon vs Team MCES,6 French League Season 1,"Wednesday, Jul 31 2019, 17:00 UTC",Europe
Mindfreak vs Fury,Six Masters 2019,"Sunday, Jul 28 2019, 7:00 UTC",Australia & New Zealand
Supremacy vs Team Vitality,6 French League Season 1,"Wednesday, Jul 31 2019, 18:00 UTC",Europe
Rogue vs Team SoloMid,United States Nationals 2019,"Wednesday, Jul 31 2019, 0:00 UTC",North America
Bastille Legacy vs PENTA Sports,6 French League Season 1,"Wednesday, Jul 31 2019, 20:00 UTC",Europe
GameWard Team vs Looking for Org.,6 French League Season 1,"Wednesday, Jul 31 2019, 19:00 UTC",Europe
DarkZero Esports vs FaZe Clan,Six Major Raleigh,"Wednesday, Aug 14 2019, 20:00 UTC","LAN,"
Spacestation Gaming vs Team Secret,Six Major Raleigh,"Friday, Aug 16 2019, 17:00 UTC","LAN,"
forZe vs Giants Gaming,Six Major Raleigh,"Friday, Aug 16 2019, 14:00 UTC","LAN,"
Team SoloMid vs MIBR,Six Major Raleigh,"Wednesday, Aug 14 2019, 22:00 UTC","LAN,"
Rise Nation vs Spacestation Gaming,United States Nationals 2019,"Friday, Aug 2 2019, 0:00 UTC",North America
Team Secret vs Team Empire,Six Major Raleigh,"Saturday, Aug 17 2019, 16:30 UTC","LAN,"
forZe vs G2 Esports,Six Major Raleigh,"Saturday, Aug 17 2019, 19:30 UTC","LAN,"
Team Empire vs FaZe Clan,Six Major Raleigh,"Friday, Aug 16 2019, 20:00 UTC","LAN,"
G2 Esports vs Team Empire,Six Major Raleigh,"Sunday, Aug 18 2019, 19:00 UTC","LAN,"
ACME Association vs Mindfreak,Six Masters 2019 Finals,"Saturday, Aug 31 2019, 0:00 UTC","LAN,"
G2 Esports vs Team SoloMid,Six Major Raleigh,"Friday, Aug 16 2019, 23:00 UTC","LAN,"
0RGL3SS vs Mindfreak,Six Masters 2019 Finals,"Saturday, Aug 31 2019, 23:00 UTC","LAN,"
Fnatic vs Oddity Esports,Six Masters 2019 Finals,"Saturday, Aug 31 2019, 7:10 UTC","LAN,"
Rhythm vs 0RGL3SS,Six Masters 2019 Finals,"Friday, Aug 30 2019, 7:00 UTC","LAN,"
Team SiNister vs Fury,Six Masters 2019 Finals,"Saturday, Aug 31 2019, 3:35 UTC","LAN,"
Fury vs Fnatic,Six Masters 2019 Finals,"Sunday, Sep 1 2019, 2:25 UTC","LAN,"
Team Liquid vs Luminosity Gaming,DreamHack Montreal 2019,"Friday, Sep 6 2019, 16:00 UTC","LAN,"
Team SoloMid vs Soniqs,DreamHack Montreal 2019,"Friday, Sep 6 2019, 16:00 UTC","LAN,"
Evil Geniuses vs LiViD Gaming,DreamHack Montreal 2019,"Friday, Sep 6 2019, 22:20 UTC","LAN,"
DarkZero Esports vs Father's Back,DreamHack Montreal 2019,"Friday, Sep 6 2019, 16:00 UTC","LAN,"
Chaos vs Team Reciprocity,DreamHack Montreal 2019,"Friday, Sep 6 2019, 19:10 UTC","LAN,"
0RGL3SS vs Fnatic,Six Masters 2019 Finals,"Sunday, Sep 1 2019, 6:10 UTC","LAN,"
Team Liquid vs Evil Geniuses,DreamHack Montreal 2019,"Sunday, Sep 8 2019, 14:00 UTC","LAN,"
DarkZero Esports vs BDS Esport,DreamHack Montreal 2019,"Saturday, Sep 7 2019, 23:45 UTC","LAN,"
Team SoloMid vs BDS Esport,DreamHack Montreal 2019,"Sunday, Sep 8 2019, 17:20 UTC","LAN,"
Team Liquid vs Team SoloMid,DreamHack Montreal 2019,"Sunday, Sep 8 2019, 20:25 UTC","LAN,"
Spacestation Gaming vs Rogue,DreamHack Montreal 2019,"Friday, Sep 6 2019, 22:20 UTC","LAN,"
Team Vitality vs Supremacy,6 French League Season 1,"Tuesday, Sep 10 2019, 18:00 UTC",Europe
PENTA Sports vs SeekOrg,6 French League Season 1,"Tuesday, Sep 10 2019, 19:00 UTC",Europe
Team MCES vs Team Oplon,6 French League Season 1,"Tuesday, Sep 10 2019, 17:00 UTC",Europe
Giants Gaming vs GameWard Team,6 French League Season 1,"Tuesday, Sep 10 2019, 20:00 UTC",Europe
Disrupt Gaming vs Luminosity Gaming,United States Nationals 2019,"Wednesday, Sep 18 2019, 1:00 UTC",North America
PsykoPaths Gaming vs Grizzlys Esports,Canada Nationals 2019,"Saturday, Sep 14 2019, 23:00 UTC",North America
Two Faced vs Draak Esports,United States Nationals 2019,"Wednesday, Sep 18 2019, 0:00 UTC",North America
Fnatic vs Mindfreak,Pro League Season 10 Australia & New Zealand,"Wednesday, Sep 18 2019, 10:00 UTC",Australia & New Zealand
Two Faced vs Disrupt Gaming,United States Nationals 2019,"Wednesday, Sep 18 2019, 2:00 UTC",North America
Wildcard Gaming vs Oddity Esports,Pro League Season 10 Australia & New Zealand,"Wednesday, Sep 18 2019, 11:00 UTC",Australia & New Zealand
NORA-Rengo vs Father's Back,Pro League Season 10 Japan,"Wednesday, Sep 18 2019, 12:00 UTC",Japan
NORA-Rengo vs Father's Back,Pro League Season 10 Japan,"Wednesday, Sep 18 2019, 13:00 UTC",Japan
CYCLOPS athlete gaming vs FAV Gaming,Pro League Season 10 Japan,"Wednesday, Sep 18 2019, 14:00 UTC",Japan
Fnatic vs Mindfreak,Pro League Season 10 Australia & New Zealand,"Wednesday, Sep 18 2019, 9:00 UTC",Australia & New Zealand
Aerowolf vs Luminescent,Pro League Season 10 South-East Asia,"Wednesday, Sep 18 2019, 14:00 UTC",South-East Asia
Wildcard Gaming vs Oddity Esports,Pro League Season 10 Australia & New Zealand,"Wednesday, Sep 18 2019, 12:00 UTC",Australia & New Zealand
Xavier Esports vs Aerowolf,Pro League Season 10 South-East Asia,"Tuesday, Sep 24 2019, 14:00 UTC",South-East Asia
Team SiNister vs Cryptik,Pro League Season 10 Australia & New Zealand,"Thursday, Sep 19 2019, 10:00 UTC",Australia & New Zealand
Father's Back vs DetonatioN Gaming,Pro League Season 10 Japan,"Tuesday, Sep 24 2019, 14:00 UTC",Japan
CYCLOPS athlete gaming vs FAV Gaming,Pro League Season 10 Japan,"Wednesday, Sep 18 2019, 15:00 UTC",Japan
Aerowolf vs Luminescent,Pro League Season 10 South-East Asia,"Wednesday, Sep 18 2019, 13:00 UTC",South-East Asia
Father's Back vs DetonatioN Gaming,Pro League Season 10 Japan,"Tuesday, Sep 24 2019, 15:00 UTC",Japan
Team SiNister vs Cryptik,Pro League Season 10 Australia & New Zealand,"Thursday, Sep 19 2019, 9:00 UTC",Australia & New Zealand
NORA-Rengo vs CYCLOPS athlete gaming,Pro League Season 10 Japan,"Tuesday, Sep 24 2019, 13:00 UTC",Japan
Draak Esports vs Evil Geniuses,United States Nationals 2019,"Wednesday, Sep 25 2019, 2:00 UTC",North America
Two Faced vs Evil Geniuses,United States Nationals 2019,"Wednesday, Sep 25 2019, 1:00 UTC",North America
Draak Esports vs Luminosity Gaming,United States Nationals 2019,"Wednesday, Sep 25 2019, 0:00 UTC",North America
FAV Gaming vs YOSHIMOTO Gaming Lamy,Pro League Season 10 Japan,"Wednesday, Sep 25 2019, 12:00 UTC",Japan
Team SiNister vs Fury,Pro League Season 10 Australia & New Zealand,"Wednesday, Sep 25 2019, 10:00 UTC",Australia & New Zealand
FAV Gaming vs YOSHIMOTO Gaming Lamy,Pro League Season 10 Japan,"Wednesday, Sep 25 2019, 13:00 UTC",Japan
Team SiNister vs Fury,Pro League Season 10 Australia & New Zealand,"Wednesday, Sep 25 2019, 9:00 UTC",Australia & New Zealand
Unsold Stuff Gaming vs GUTS Gaming,Pro League Season 10 Japan,"Wednesday, Sep 25 2019, 15:00 UTC",Japan
Aethra Esports vs Aura Esports,Benelux League Season 4,"Wednesday, Sep 25 2019, 17:00 UTC",Europe
PENTA Sports vs GameWard Team,6 French League Season 1,"Wednesday, Sep 25 2019, 17:00 UTC",Europe
Gunners vs Stage5 Gaming,Benelux League Season 4,"Wednesday, Sep 25 2019, 18:00 UTC",Europe
Unsold Stuff Gaming vs GUTS Gaming,Pro League Season 10 Japan,"Wednesday, Sep 25 2019, 14:00 UTC",Japan
Black Dragons vs MIBR,Pro League Season 10 Latin America,"Wednesday, Sep 25 2019, 17:00 UTC",Latin America
Team MCES vs Supremacy,6 French League Season 1,"Wednesday, Sep 25 2019, 18:00 UTC",Europe
Fnatic vs Team SiNister,Pro League Season 10 Australia & New Zealand,"Thursday, Sep 26 2019, 11:00 UTC",Australia & New Zealand
Oddity Esports vs Fury,Pro League Season 10 Australia & New Zealand,"Thursday, Sep 26 2019, 11:00 UTC",Australia & New Zealand
Aerowolf vs Lese Esports,Pro League Season 10 South-East Asia,"Thursday, Sep 26 2019, 12:00 UTC",South-East Asia
Fnatic vs Team SiNister,Pro League Season 10 Australia & New Zealand,"Thursday, Sep 26 2019, 12:00 UTC",Australia & New Zealand
Father's Back vs YOSHIMOTO Gaming Lamy,Pro League Season 10 Japan,"Thursday, Sep 26 2019, 12:00 UTC",Japan
CYCLOPS athlete gaming vs DetonatioN Gaming,Pro League Season 10 Japan,"Thursday, Sep 26 2019, 12:00 UTC",Japan
CYCLOPS athlete gaming vs DetonatioN Gaming,Pro League Season 10 Japan,"Thursday, Sep 26 2019, 13:00 UTC",Japan
Father's Back vs YOSHIMOTO Gaming Lamy,Pro League Season 10 Japan,"Thursday, Sep 26 2019, 13:00 UTC",Japan
NORA-Rengo vs Unsold Stuff Gaming,Pro League Season 10 Japan,"Thursday, Sep 26 2019, 14:00 UTC",Japan
FAV Gaming vs GUTS Gaming,Pro League Season 10 Japan,"Thursday, Sep 26 2019, 14:00 UTC",Japan
Team Secret vs forZe,Challenger League Season 10 Europe,"Thursday, Sep 26 2019, 16:00 UTC",Europe
FAV Gaming vs GUTS Gaming,Pro League Season 10 Japan,"Thursday, Sep 26 2019, 15:00 UTC",Japan
Oddity Esports vs Fury,Pro League Season 10 Australia & New Zealand,"Thursday, Sep 26 2019, 12:00 UTC",Australia & New Zealand
GameWard Team vs KKona KKopteri,Challenger League Season 10 Europe,"Thursday, Sep 26 2019, 18:00 UTC",Europe
SYZYGY vs OrgLess,Challenger League Season 10 Europe,"Thursday, Sep 26 2019, 17:00 UTC",Europe
Team Secret vs forZe,Challenger League Season 10 Europe,"Thursday, Sep 26 2019, 17:00 UTC",Europe
BDS Esport vs Trust Gaming,Challenger League Season 10 Europe,"Thursday, Sep 26 2019, 18:00 UTC",Europe
GameWard Team vs KKona KKopteri,Challenger League Season 10 Europe,"Thursday, Sep 26 2019, 19:00 UTC",Europe
NORA-Rengo vs Unsold Stuff Gaming,Pro League Season 10 Japan,"Thursday, Sep 26 2019, 15:00 UTC",Japan
Rise Nation vs Katsu,United States Nationals 2019,"Friday, Sep 27 2019, 0:00 UTC",North America
SYZYGY vs OrgLess,Challenger League Season 10 Europe,"Thursday, Sep 26 2019, 16:00 UTC",Europe
BDS Esport vs Trust Gaming,Challenger League Season 10 Europe,"Thursday, Sep 26 2019, 19:00 UTC",Europe
G2 Esports vs Team Empire,Pro League Season 10 Europe,"Friday, Sep 27 2019, 17:15 UTC",Europe
Shrug vs Rise Nation,Challenger League Season 10 North America,"Saturday, Sep 28 2019, 1:00 UTC",North America
Guardians Imperium E-Sports vs SemOrg Team,Challenger League Season 10 Latin America,"Saturday, Sep 28 2019, 1:00 UTC",Latin America
Katsu vs Parallax Gaming,United States Nationals 2019,"Friday, Sep 27 2019, 2:00 UTC",North America
Ninjas In Pyjamas vs Black Dragons,Pro League Season 10 Latin America,"Saturday, Sep 28 2019, 1:45 UTC",Latin America
Team Vitality vs Chaos,Pro League Season 10 Europe,"Friday, Sep 27 2019, 16:00 UTC",Europe
Disrupt Gaming vs Two Faced,Challenger League Season 10 North America,"Saturday, Sep 28 2019, 2:00 UTC",North America
Disrupt Gaming vs Two Faced,Challenger League Season 10 North America,"Saturday, Sep 28 2019, 3:00 UTC",North America
Obey Alliance vs Parallax Gaming,United States Nationals 2019,"Friday, Sep 27 2019, 1:00 UTC",North America
Akatsuki vs Adventure Force,Challenger League Season 10 North America,"Saturday, Sep 28 2019, 3:00 UTC",North America
Team Empire vs GiFu eSports,Pro League Season 10 Europe,"Monday, Sep 30 2019, 16:00 UTC",Europe
Akatsuki vs Adventure Force,Challenger League Season 10 North America,"Saturday, Sep 28 2019, 2:00 UTC",North America
PENTA Sports vs Chaos,Pro League Season 10 Europe,"Monday, Sep 30 2019, 18:30 UTC",Europe
PsykoPaths Gaming vs Super Nova,Canada Nationals 2019,"Saturday, Sep 28 2019, 23:00 UTC",North America
Giants Gaming vs Natus Vincere,Pro League Season 10 Europe,"Monday, Sep 30 2019, 17:15 UTC",Europe
Parallax Gaming vs Obey Alliance,Challenger League Season 10 North America,"Saturday, Sep 28 2019, 1:00 UTC",North America
G2 Esports vs Team Vitality,Pro League Season 10 Europe,"Monday, Sep 30 2019, 19:45 UTC",Europe
Team Reciprocity vs Rogue,Pro League Season 10 North America,"Tuesday, Oct 1 2019, 0:00 UTC",North America
Banana Boat Crew vs Luminosity Gaming,United States Nationals 2019,"Wednesday, Oct 2 2019, 1:00 UTC",North America
DarkZero Esports vs Luminosity Gaming,Pro League Season 10 North America,"Tuesday, Oct 1 2019, 1:15 UTC",North America
Adventure Force vs Azara Gaming,United States Nationals 2019,"Wednesday, Oct 2 2019, 0:00 UTC",North America
Adventure Force vs Luminosity Gaming,United States Nationals 2019,"Wednesday, Oct 2 2019, 2:00 UTC",North America
ECV esports vs FACT Gaming,Benelux League Season 4,"Wednesday, Oct 2 2019, 17:00 UTC",Europe
BeKind vs Supremacy,6 French League Season 1,"Wednesday, Oct 2 2019, 17:00 UTC",Europe
Black Dragons vs INTZ e-Sports,Pro League Season 10 Latin America,"Wednesday, Oct 2 2019, 17:00 UTC",Latin America
Spacestation Gaming vs Team SoloMid,Pro League Season 10 North America,"Tuesday, Oct 1 2019, 2:30 UTC",North America
Trust Gaming vs LAGr Gaming,Benelux League Season 4,"Wednesday, Oct 2 2019, 18:00 UTC",Europe
Soniqs vs Evil Geniuses,Pro League Season 10 North America,"Tuesday, Oct 1 2019, 3:45 UTC",North America
Team MCES vs Giants Gaming,6 French League Season 1,"Wednesday, Oct 2 2019, 18:00 UTC",Europe
Team Secret vs OrgLess,Challenger League Season 10 Europe,"Thursday, Oct 3 2019, 19:00 UTC",Europe
BDS Esport vs KKona KKopteri,Challenger League Season 10 Europe,"Thursday, Oct 3 2019, 19:00 UTC",Europe
bruh vs Relegated,United States Nationals 2019,"Friday, Oct 4 2019, 0:00 UTC",North America
Ninjas In Pyjamas vs MIBR,Pro League Season 10 Latin America,"Wednesday, Oct 2 2019, 18:15 UTC",Latin America
bruh vs Obey Alliance,United States Nationals 2019,"Friday, Oct 4 2019, 2:00 UTC",North America
Team Vitality vs Team Empire,Pro League Season 10 Europe,"Friday, Oct 4 2019, 17:15 UTC",Europe
Obey Alliance vs Akatsuki,United States Nationals 2019,"Friday, Oct 4 2019, 1:00 UTC",North America
Chaos vs Giants Gaming,Pro League Season 10 Europe,"Friday, Oct 4 2019, 19:45 UTC",Europe
SuperNova Team e-Sports vs YeaH Gaming,Challenger League Season 10 Latin America,"Friday, Oct 4 2019, 22:00 UTC",Latin America
Natus Vincere vs PENTA Sports,Pro League Season 10 Europe,"Friday, Oct 4 2019, 18:30 UTC",Europe
Team Liquid vs MIBR,Pro League Season 10 Latin America,"Friday, Oct 4 2019, 22:00 UTC",Latin America
Looking for Org BR vs SemOrg Team,Challenger League Season 10 Latin America,"Friday, Oct 4 2019, 22:00 UTC",Latin America
